{
  "$schema": "https://json-schema.org/draft/2020-12/schema",
  "$id": "https://roninforge.org/hanko/plugin.schema.json",
  "title": "Claude Code Plugin Manifest",
  "type": "object",
  "additionalProperties": false,
  "required": ["name"],
  "properties": {
    "$schema": { "type": "string", "format": "uri" },
    "name": {
      "type": "string",
      "description": "Plugin identifier. Kebab-case per docs.",
      "pattern": "^[a-z0-9]+(-[a-z0-9]+)*$"
    },
    "version": {
      "type": "string",
      "description": "Semantic version (MAJOR.MINOR.PATCH[-PRERELEASE][+BUILD]).",
      "pattern": "^(0|[1-9]\\d*)\\.(0|[1-9]\\d*)\\.(0|[1-9]\\d*)(?:-[0-9A-Za-z-]+(?:\\.[0-9A-Za-z-]+)*)?(?:\\+[0-9A-Za-z-]+(?:\\.[0-9A-Za-z-]+)*)?$"
    },
    "description": { "type": "string", "minLength": 1 },
    "author": { "$ref": "#/$defs/authorObject" },
    "homepage": { "type": "string", "format": "uri" },
    "repository": {
      "oneOf": [
        { "type": "string", "format": "uri" },
        { "$ref": "#/$defs/repositoryObject" }
      ]
    },
    "license": { "type": "string", "minLength": 1 },
    "keywords": { "type": "array", "items": { "type": "string" }, "uniqueItems": true },
    "category": { "type": "string" },
    "tags": { "type": "array", "items": { "type": "string" } },
    "skills": { "$ref": "#/$defs/pathOrPathArray" },
    "commands": { "$ref": "#/$defs/pathOrPathArray" },
    "agents": { "$ref": "#/$defs/pathOrPathArray" },
    "outputStyles": { "$ref": "#/$defs/pathOrPathArray" },
    "hooks": {
      "oneOf": [
        { "$ref": "#/$defs/pathOrPathArray" },
        { "$ref": "#/$defs/hooksInline" }
      ]
    },
    "mcpServers": {
      "oneOf": [
        { "$ref": "#/$defs/pathOrPathArray" },
        { "$ref": "#/$defs/mcpInline" }
      ]
    },
    "lspServers": {
      "oneOf": [
        { "$ref": "#/$defs/pathOrPathArray" },
        { "$ref": "#/$defs/lspInline" }
      ]
    },
    "monitors": {
      "oneOf": [
        { "$ref": "#/$defs/pathOrPathArray" },
        { "$ref": "#/$defs/monitorsInline" }
      ]
    },
    "userConfig": { "$ref": "#/$defs/userConfigObject" },
    "channels": { "type": "array", "items": { "$ref": "#/$defs/channelEntry" } },
    "dependencies": {
      "type": "array",
      "items": {
        "oneOf": [
          { "type": "string" },
          { "$ref": "#/$defs/dependencyEntry" }
        ]
      }
    },
    "settings": { "type": "object", "additionalProperties": true }
  },
  "$defs": {
    "authorObject": {
      "type": "object",
      "additionalProperties": false,
      "required": ["name"],
      "properties": {
        "name": { "type": "string", "minLength": 1 },
        "email": { "type": "string", "format": "email" },
        "url": { "type": "string", "format": "uri" }
      }
    },
    "repositoryObject": {
      "type": "object",
      "additionalProperties": false,
      "required": ["type", "url"],
      "properties": {
        "type": { "type": "string" },
        "url": { "type": "string", "format": "uri" },
        "directory": { "type": "string" }
      }
    },
    "relativePath": {
      "type": "string",
      "pattern": "^\\./",
      "allOf": [
        { "not": { "pattern": "\\.\\." } },
        { "not": { "pattern": "\\\\" } }
      ]
    },
    "pathOrPathArray": {
      "oneOf": [
        { "$ref": "#/$defs/relativePath" },
        {
          "type": "array",
          "items": { "$ref": "#/$defs/relativePath" }
        }
      ]
    },
    "hooksInline": {
      "type": "object",
      "patternProperties": {
        "^(SessionStart|UserPromptSubmit|PreToolUse|PermissionRequest|PermissionDenied|PostToolUse|PostToolUseFailure|Notification|SubagentStart|SubagentStop|TaskCreated|TaskCompleted|Stop|StopFailure|TeammateIdle|InstructionsLoaded|ConfigChange|CwdChanged|FileChanged|WorktreeCreate|WorktreeRemove|PreCompact|PostCompact|Elicitation|ElicitationResult|SessionEnd)$": {
          "type": "array",
          "items": { "$ref": "#/$defs/hookMatcherGroup" }
        }
      },
      "additionalProperties": false
    },
    "hookMatcherGroup": {
      "type": "object",
      "additionalProperties": false,
      "required": ["hooks"],
      "properties": {
        "matcher": { "type": "string" },
        "hooks": {
          "type": "array",
          "minItems": 1,
          "items": { "$ref": "#/$defs/hookHandler" }
        }
      }
    },
    "hookHandler": {
      "type": "object",
      "required": ["type"],
      "properties": {
        "type": { "enum": ["command", "http", "prompt", "agent"] },
        "timeout": { "type": "number", "minimum": 0 },
        "statusMessage": { "type": "string" },
        "once": { "type": "boolean" },
        "command": { "type": "string" },
        "url": { "type": "string", "format": "uri" },
        "async": { "type": "boolean" },
        "prompt": { "type": "string" },
        "model": { "type": "string" }
      },
      "allOf": [
        { "if": { "properties": { "type": { "const": "command" } } }, "then": { "required": ["command"] } },
        { "if": { "properties": { "type": { "const": "http" } } }, "then": { "required": ["url"] } },
        { "if": { "properties": { "type": { "const": "prompt" } } }, "then": { "required": ["prompt"] } },
        { "if": { "properties": { "type": { "const": "agent" } } }, "then": { "required": ["prompt"] } }
      ]
    },
    "mcpInline": {
      "type": "object",
      "additionalProperties": { "$ref": "#/$defs/mcpServer" }
    },
    "mcpServer": {
      "type": "object",
      "additionalProperties": false,
      "required": ["command"],
      "properties": {
        "command": { "type": "string" },
        "args": { "type": "array", "items": { "type": "string" } },
        "env": { "type": "object", "additionalProperties": { "type": "string" } },
        "cwd": { "type": "string" }
      }
    },
    "lspInline": {
      "type": "object",
      "additionalProperties": { "$ref": "#/$defs/lspServer" }
    },
    "lspServer": {
      "type": "object",
      "additionalProperties": false,
      "required": ["command", "extensionToLanguage"],
      "properties": {
        "command": { "type": "string" },
        "args": { "type": "array", "items": { "type": "string" } },
        "extensionToLanguage": {
          "type": "object",
          "minProperties": 1,
          "propertyNames": { "pattern": "^\\.[A-Za-z0-9]+$" },
          "additionalProperties": { "type": "string" }
        },
        "transport": { "enum": ["stdio", "socket"] },
        "env": { "type": "object", "additionalProperties": { "type": "string" } },
        "initializationOptions": {},
        "settings": {},
        "workspaceFolder": { "type": "string" },
        "startupTimeout": { "type": "integer", "minimum": 0 },
        "shutdownTimeout": { "type": "integer", "minimum": 0 },
        "restartOnCrash": { "type": "boolean" },
        "maxRestarts": { "type": "integer", "minimum": 0 }
      }
    },
    "monitorsInline": {
      "type": "array",
      "items": {
        "type": "object",
        "additionalProperties": false,
        "required": ["name", "command", "description"],
        "properties": {
          "name": { "type": "string" },
          "command": { "type": "string" },
          "description": { "type": "string" },
          "when": { "type": "string", "pattern": "^(always|on-skill-invoke:[a-z0-9-]+)$" }
        }
      }
    },
    "userConfigObject": {
      "type": "object",
      "patternProperties": {
        "^[A-Za-z_][A-Za-z0-9_]*$": {
          "type": "object",
          "additionalProperties": false,
          "required": ["description"],
          "properties": {
            "description": { "type": "string" },
            "sensitive": { "type": "boolean" }
          }
        }
      },
      "additionalProperties": false
    },
    "channelEntry": {
      "type": "object",
      "additionalProperties": false,
      "required": ["server"],
      "properties": {
        "server": { "type": "string" },
        "userConfig": { "$ref": "#/$defs/userConfigObject" }
      }
    },
    "dependencyEntry": {
      "type": "object",
      "additionalProperties": false,
      "required": ["name"],
      "properties": {
        "name": { "type": "string" },
        "version": { "type": "string" }
      }
    }
  }
}

